{
  "manifest_version": "1.1",
  "source_base_commit": "ee725f7cf923d86d915900fc93ef2e3f6e5eef1c",
  "release_commit": null,
  "docker_image": null,
  "environment": {
    "os": "linux",
    "architecture": "amd64",
    "go_version": "1.23",
    "python_version": "3.9"
  },
  "environment_status": "DECLARED_NOT_REPLAYED",
  "authority_ledger_hash": "82713cf5a2d9d294c80ba912d51fc4e29bd460c680686ed2f71f74415addb0c9",
  "expected_head_hash": "e3ff77f12b8663c1fe1ac14bf1e1bd7d675e969f54e49462f4abcf1f41f97e85",
  "expected_state_digest": null,
  "state_digest_status": "NOT_COMPUTED_FROM_RUNTIME",
  "timestamp": "2026-10-06T17:26:00Z",
  "manifest_hash": "7959510fc80c8cd44f4b40e0368230c692ddf95668c0d8c6c96e0471a6b0dbea"
}
